{
  "schema_name": "facility_scope_contract",
  "schema_version": "1.0.0",
  "contract_id": "facility_scope_contract.v1",
  "scope_type": "facility",
  "authority": "explicit_generation_time_semantic_scope",
  "subtypes": {
    "barrier": {
      "ontology_class_id": "world:Barrier",
      "service_kind": "none",
      "source_asset_ids": [
        "facility.barrier.basic"
      ],
      "source_entity_kinds": [
        "facility.barrier"
      ]
    },
    "charging_station": {
      "ontology_class_id": "world:ChargingStation",
      "service_kind": "charging",
      "service_capacity": 1,
      "source_asset_ids": [
        "facility.charger.cityops.v1",
        "facility.charging_pile.basic"
      ],
      "source_entity_kinds": [
        "facility.charger"
      ]
    },
    "communication_base_station": {
      "ontology_class_id": "world:CommunicationStation",
      "service_kind": "none",
      "source_asset_ids": [
        "facility.radio.base_tower.v1"
      ],
      "source_entity_kinds": [
        "facility.base_station"
      ]
    },
    "ground_control_station": {
      "ontology_class_id": "world:GroundControlStation",
      "service_kind": "none",
      "requires_explicit_declaration": true,
      "source_asset_ids": [],
      "source_entity_kinds": [
        "ground_station.ground_control_station"
      ]
    },
    "landing_pad": {
      "ontology_class_id": "world:LandingPad",
      "service_kind": "landing",
      "service_capacity": 1,
      "source_asset_ids": [
        "facility.landing_pad.visible.v1"
      ],
      "source_entity_kinds": [
        "facility.landing_pad"
      ]
    },
    "no_fly_zone": {
      "ontology_class_id": "world:NoFlyZone",
      "service_kind": "none",
      "source_asset_ids": [
        "trigger.hazard.generic.box.v1",
        "trigger.no_fly.box.v1"
      ],
      "source_entity_kinds": [
        "facility.no_fly_zone"
      ]
    },
    "radio_tower": {
      "ontology_class_id": "world:RadioTower",
      "service_kind": "none",
      "requires_explicit_declaration": true,
      "source_asset_ids": [],
      "source_entity_kinds": [
        "ground_station.radio_tower"
      ]
    }
  }
}
